124,10.1111_mec.16111.pdf,gompert,yes,gene flow,multiple_temporal,,"census, contemporary variance (Bayesian bootstrap Gompert 2016), genetic diversity (ANGSD)",see notes file,gompert,yes,multiple_spatial,natural evolution,pi,no change,pi = 0.0092 ,full details in table S4; no sig variation among years,gompert,NA,NA,NA,NA,NA,NA,NA,Gompert,Yes,Yes,No,No,yes,fragmented populations,no change,"PCA, pairwise Fst",see doc,yes,multiple_spatial; multiple_temporal,natural,constant,dadi and Bayesian F model,"assume a mutation rate of 2.9 √ó 10‚àí9 (from the butterfly Heliconius melpomene; Keightley et al., 2015) and œÄ = 0.0092 (our mean estimate), diversity levels suggest a global, long- term effective population size of ~793,000. This is ~4500 times greater than the average variance effective population size we estimated and thus would require ~4500 populations of this size connected by gene flow",gompert,no,NA,NA,NA,NA,NA,NA,NA,NA,gompert,yes,multiple_temporal,natural evolution,allele frequency change,yes,Change in allele frequency delta p ~ 0.02 and 5% of SNPs showing change >0.05 over a few generations,NA,NA,Gompert,yes,multiple temporal,fragmented populations,spacetime,genomewide,no,see doc,gompert,NA,NA,NA,NA,NA,NA,NA,NA,NA,NA,NA,NA,NA,NA,NA,134,Yes,gompert,no,NA,NA,NA,NA,NA,august,10.1111/mec.16111,2021,,NA,,,,,,Genomic time-series data show that gene flow maintains high genetic diversity despite substantial genetic drift in a butterfly species,,article,invertebrate,Lycaeides idas,natural evolution,reduced representation,repeated,4 or 5,4 or 5,10.1111_mec.16111.pdf,natural evolution,natural evolution
125,10.1111_mec.16451.pdf,NA,NA,NA,NA,NA,NA,NA,abdullahi,yes,multiple_temporal,pollution,genome-wide SNP-alpha diversity; Ma et al. 2020 scientific reports,decreased,"Most recent: diversity = 2100.7; older time points diversity: 2627.6, 2668.3, 2585.8",full details in table S2,NA,NA,NA,NA,NA,NA,NA,NA,,No,No,No,No,NA,NA,NA,NA,NA,NA,NA,NA,NA,NA,NA,abdullahi,yes,How does historical exposure to chemicals affect future tolerance to chemicals in Daphnia?,candidate gene list,multiple_temporal,pollution; anthropogenic,alpha and beta snp diversity,incomprehensible,NA,NA,NA,NA,NA,NA,NA,NA,NA,NA,NA,,,,,,,,,NA,NA,NA,NA,NA,NA,NA,NA,NA,NA,NA,NA,NA,NA,NA,NA,135,No,NA,NA,NA,NA,NA,NA,NA,may,10.1111/mec.16451,2022,Molecular Ecology,31,11,NA scopus NA,Abdullahi M.; Zhou J.; Dandhapani V.; Chaturvedi A.; Orsini L.,Abdullahi,,historical exposure to chemicals reduces tolerance to novel chemical stress in daphnia (waterflea),Resurrection experiment; Assumes a generation per year,article,invertebrate,Daphnia magna,pollution; anthropogenic,WGS,historical,50,50,10.1111_mec.16451.pdf,anthropogenic,anthropogenic
126,10.1111_mec.16748.pdf,pfenninger,no,NA,NA,NA,NA,NA,NA,NA,NA,NA,NA,NA,NA,NA,NA,NA,NA,NA,NA,NA,NA,NA,,No,No,No,No,NA,NA,NA,NA,NA,NA,NA,NA,NA,NA,NA,pfenninger,yes,How did a cold snap affect genomic diversity in a biting midge population?,candidate gene list,multiple_temporal,cold temperature,tajima's d,yes,NA,NA,pfenninger ,no,NA,NA,NA,NA,NA,NA,controlled for drift but not really a focal result,,,,,,,,,pfenninger,yes,multiple_temporal,cold snap; short-term weather events,sliding window,see notes doc,yes,yes,NA,NA,NA,NA,NA,NA,NA,NA,137,Yes,pfenninger,yes,yes,yes,NA,NA,same alleles under selection during natural cold snap and laboratory cold snap,august,10.1111/mec.16748,2023,,NA,,,Pfenninger M.; Foucault Q.; Waldvogel A.-M.; Feldmeyer B.,Pfenninger,,Selective effects of a short transient environmental fluctuation on a natural population,,article,invertebrate,Chironomus riparius,natural evolution,WGS,repeated,0.5 or 0.58333333,6.5,10.1111_mec.16748.pdf,natural evolution,natural evolution
127,10.1111_mec.16760.pdf,osborne,yes,captive breeding; anthropogenic,multiple_temporal,increase," standard diversity measures (Nei's unbiased gene diversity [uHS], observed heterozygosity [HO] and allelic richness [AR]), variance genetically effective population size (NeV), and linkage disequilibrium effective population size (NeD).",,NA,NA,NA,NA,NA,NA,NA,NA,osborne,yes,multiple_temporal,habitat destruction; anthropogenic,"increase; only validated by one method, other did not detect inbreeding trend",see notes doc,see noted doc,NA,Osborne,Yes,Yes,No,No,no,NA,NA,NA,NA,NA,NA,NA,NA,NA,NA,osborne,no,NA,NA,NA,NA,NA,NA,NA,NA,osborne,no,NA,NA,NA,NA,NA,NA,results imply drift in some years but not measured directly,Osborne,no,NA,NA,NA,NA,NA,NA,osborne,NA,NA,NA,NA,NA,NA,NA,NA,NA,NA,NA,NA,NA,NA,NA,138,No,NA,NA,NA,NA,NA,NA,NA,august,10.1111/mec.16760,2023,,NA,,,Osborne M.J.; Caeiro-Dias G.; Turner T.F.,Osborne,,Transitioning from microsatellites to SNP-based microhaplotypes in genetic monitoring programmes: Lessons from paired data spanning 20 years,,article,vertebrate,Hybognathus amarus,natural evolution,reduced representation,repeated,19,19,10.1111_mec.16760.pdf,anthropogenic,anthropogenic
128,10.1111_mec.16933.pdf,NA,NA,NA,NA,NA,NA,NA,NA,NA,NA,NA,NA,NA,NA,NA,NA,NA,NA,NA,NA,NA,NA,NA,Besnier,No,Yes,No,No,no,NA,NA,NA,NA,yes,multiple_temporal,environmental change; anthropogenic,increase,Proportion of wild genome computed via STRUCTURE,"The salmon population in the river Etne has been subject to introgression from domesticated salmon escaping from commercial fish farms, with an average 24%	of	genetic	admixture	in	the	contemporary	population. When	predicting	age	at	maturation	from	the	joined	effect	of	admixture and genotype, no interaction was detected between individual admixture and vgll3 genotype (œá2‚Äâ=‚Äâ3.6,	df‚Äâ=‚Äâ2,	p‚Äâ=‚Äâ.161),	nor	between individual admixture and six6 genotype (œá2‚Äâ=‚Äâ2.7,	df‚Äâ=‚Äâ2,	p‚Äâ=‚Äâ.24),	indicating	that	the	temporal	dissociation	between	these	loci	and age at maturation was independent from individual admixture.",besnier,no,NA,NA,NA,NA,NA,NA,NA,NA,NA,NA,NA,NA,NA,NA,NA,NA,NA,,,,,,,,,NA,NA,NA,NA,NA,NA,NA,NA,NA,NA,NA,NA,NA,NA,NA,NA,139,Yes,besnier,no,NA,NA,NA,NA,NA,may,10.1111/mec.16933,2024,MOL ECOL,33,2,NA scopus wos,Besnier F.; Skaala ‚àö√≤.; Wennevik V.; Ayllon F.; Utne K.R.; Fjeldheim P.T.; Andersen-Fjeldheim K.; Knutar S.; Glover K.A.,Besnier,phenotypic plasticity; salmon maturation; sexual conflict; six6; vgll3,overruled by nature: a plastic response to environmental change disconnects a gene and its trait,Generation time seems hard to estimate; they discuss proportion of salmon that are mature at 1 year; so I'm going to say 1.5 year gen time,article,vertebrate,Salmo salar,Environmental change,reduced representation,historical,33,22,10.1111_mec.16933.pdf,anthropogenic,anthropogenic
129,10.1111_mec.17274.pdf,kellner,yes,hunting; anthropogenic,multiple_temporal,decrease,"mean per-site Watterson's theta estimator, Kumar and Subramanian 2002",,kellner,yes,multiple_spatial,hunting,sliding window pi,no change; non-significant decrease,pre-hunting period: 3.34 10 -4; during hunting 3.35 10^-4; post hunting 3.23 10^-4,,kellner,NA,NA,NA,NA,NA,NA,NA,Kellner,Yes,Yes,No,No,yes,hunting; anthropogenic factors,increase,PCA and admixture,"see doc. ""The assignment of modern groups to estimate genetic clusters strongly correlates with geography, while ancient groups do not.""",yes,multiple_spatial; multiple_temporal,hunting; population decline; anthropogenic,decrease,"PCA, NGSadmix",(Fig in doc) the spatiotemporal groups of ancient individuals are not strongly distinct from one another in the admixture analysis .,Kellner,yes,What genomic effects have a population bottleneck had on reindeer in Svalbard?,"many regions of the genome experienced selection pre-and during hunting, but now they are undergoing drift",multiple temporal,hunting; anthropogenic,"Fay and Wu's H, Fst",yes,NA,NA,kellner,yes,multiple_temporal,bottleneck; human hunting; population loss; anthropogenic,allele frequency change,yes,median heterozygosity reduced by 26% over last 4000 years,NA,NA,Kellner,yes,multiple temporal,"hunting, anthropogenic",spacetime,both,yes,see doc,kellner,NA,NA,NA,NA,NA,NA,NA,NA,NA,NA,NA,NA,NA,NA,NA,140,Yes,kellner,no,NA,NA,NA,NA,NA,may,10.1111/mec.17274,2024,MOL ECOL,33,5,NA NA wos,Kellner; FL; Le Moullec; M; Ellegaard; MR; Rosvold; J; Peeters; B; Burnett; HA; Pedersen; AO; Brealey; JC; Dussex; N; Bieker; VC; Hansen; BB; Martin; MD,Kellner,ancient DNA; bottleneck; conservation genomics; genomic erosion; population genomics; Svalbard reindeer,a palaeogenomic investigation of overharvest implications in an endemic wild reindeer subspecies,Generation time from https://www.cell.com/iscience/fulltext/S2589-0042(23)01888-6,article ,vertebrate,Rangifer tarandus platyrhynchus,overharvest; anthropogenic,WGS,historical,"2,500",417,10.1111_mec.17274.pdf,anthropogenic,anthropogenic
130,10.1126_sciadv.aax0530.pdf,NA,NA,NA,NA,NA,NA,NA,retel,yes,multiple_temporal,host-pathogen,model of allele frequencies,fluctuates,diversity increased and decreased during host-pathogen coevolution,see word document,NA,NA,NA,NA,NA,NA,NA,NA,,No,No,No,No,NA,NA,NA,NA,NA,NA,NA,NA,NA,NA,NA,retel,yes,What role does selection play in host-virus coevolution?,candidate gene list,multiple_temporal,host-pathogen,allele frequency change,yes,NA,NA,retel,no,NA,NA,NA,NA,NA,NA,NA,,,,,,,,,NA,NA,NA,NA,NA,NA,NA,NA,NA,NA,NA,NA,NA,NA,NA,NA,141,Yes,retel,yes,partial,partial,NA,NA,some parallelism observed in parasites but not hosts,august,10.1126/sciadv.aax0530,2019,,NA,,,Retel C.; Kowallik V.; Huang W.; Werner B.; K‚àö¬∫nzel S.; Becks L.; Feulner P.G.D.,Retel,,The feedback between selection and demography shapes genomic diversity during coevolution,,article,algae,Chlorella variabilis ,host-pathogen,WGS,experimental,0.2739726 or 100,100,10.1126_sciadv.aax0530.pdf,host-pathogen,host-pathogen
131,10.1128_AEM.00179-18.pdf,NA,NA,NA,NA,NA,NA,NA,NA,NA,NA,NA,NA,NA,NA,NA,NA,NA,NA,NA,NA,NA,NA,NA,,No,No,No,No,NA,NA,NA,NA,NA,NA,NA,NA,NA,NA,NA,patin,no,NA,NA,NA,NA,NA,NA,NA,NA,NA,NA,NA,NA,NA,NA,NA,NA,NA,,,,,,,,,NA,NA,NA,NA,NA,NA,NA,NA,NA,NA,NA,NA,NA,NA,NA,NA,142,No,NA,NA,NA,NA,NA,NA,NA,august,10.1128/AEM.00179-18,2018,,NA,,,Patin; Nastassia; V; Pratte; Zoe A.; Regensburger; Matthew; Hall; Eric; Glide; Kailen; Dove; Alistair D. M.; Stewart; Frank J.,Patin,,Microbiome Dynamics in a Large Artificial Seawater Aquarium,,article,bacteria,Microbe spp.,natural evolution,metagenomics,repeated,1.166666667,#N/A,10.1128_AEM.00179-18.pdf,anthropogenic,anthropogenic
132,10.1128_JB.00587-20.pdf,NA,NA,NA,NA,NA,NA,NA,NA,NA,NA,NA,NA,NA,NA,NA,NA,NA,NA,NA,NA,NA,NA,NA,,No,No,No,No,NA,NA,NA,NA,NA,NA,NA,NA,NA,NA,NA,dicks,no,NA,NA,NA,NA,NA,NA,NA,NA,NA,NA,NA,NA,NA,NA,NA,NA,NA,,,,,,,,,NA,NA,NA,NA,NA,NA,NA,NA,NA,NA,NA,NA,NA,NA,NA,NA,143,No,NA,NA,NA,NA,NA,NA,NA,may,10.1128/JB.00587-20,2021,Journal of Bacteriology,203,10,NA scopus NA,Dicks J.; Turnbull J.D.; Russell J.; Parkhill J.; Alexander S.,Dicks,Enterotoxin gene family; Genome analysis; National Collection of Type Cultures; Staphylococcus aureus,genome sequencing of a historic staphylococcus aureus collection reveals new enterotoxin genes and sheds light on the evolution and genomic organization of this key virulence gene family,generation time varies extensively. this paper gives 80 min as long term average for nasal  colonization https://doi.org/10.1186/s12864-019-5604-6,article,bacteria,Staphylococcus aureus,host-pathogen,reduced representation,historical,92,604440,10.1128_JB.00587-20.pdf,host-pathogen,host-pathogen
133,10.1128_JVI.01080-14.pdf,NA,NA,NA,NA,NA,NA,NA,NA,NA,NA,NA,NA,NA,NA,NA,NA,NA,NA,NA,NA,NA,NA,NA,,No,No,No,No,NA,NA,NA,NA,NA,NA,NA,NA,NA,NA,NA,nelson,no,,,,,,,NA,NA,NA,NA,NA,NA,NA,NA,NA,NA,NA,Nelson,no,NA,NA,NA,NA,NA,NA,NA,NA,NA,NA,NA,NA,NA,NA,nelson,yes ,NA,NA,NA,NA,NA,NA,144,No,NA,NA,NA,NA,NA,NA,NA,may,10.1128/JVI.01080-14,2014,J VIROL,88,17,NA scopus wos,Nelson M.I.; Wentworth D.E.; Culhane M.R.; Vincent A.L.; Viboud C.; LaPointe M.P.; Lin X.; Holmes E.C.; Detmer S.E.,Nelson,,introductions and evolution of human-origin seasonal influenza a viruses in multinational swine populations,gen time 2.5 days https://academic.oup.com/aje/article/167/7/775/83777,article,virus,Influenza virus,host-pathogen,WGS,historical,9,1314,10.1128_JVI.01080-14.pdf,host-pathogen,host-pathogen
134,10.1128_JVI.01519-08.pdf,bird,yes,epidemic,multiple_temporal,increase,"The timing of any potential population expan- sion event was calculated using the formula t   /2l, where  is the mutation rate in terms of substitutions/site/year and l is the length of the nucleotide sequence.",,bird,no,NA,NA,NA,NA,NA,Suggests nucleotide diversity of the virus increased during outbreak but doesn't report stats,NA,NA,NA,NA,NA,NA,NA,NA,,No,No,No,No,NA,NA,NA,NA,NA,NA,NA,NA,NA,NA,NA,bird,no,NA,NA,NA,NA,NA,NA,NA,NA,NA,NA,NA,NA,NA,NA,NA,NA,NA,,,,,,,,,bird,yes,multiple_spatial,outbreak; natural evolution,entire genome,see notes doc,no,NA,bird,NA,NA,NA,NA,NA,NA,NA,145,No,NA,NA,NA,NA,NA,NA,NA,may,10.1128/JVI.01519-08,2008,J VIROL,82,22,NA scopus wos,Bird B.H.; Githinji J.W.K.; Macharia J.M.; Kasiiti J.L.; Muriithi R.M.; Gacheru S.G.; Musaa J.O.; Towner J.S.; Reeder S.A.; Oliver J.B.; Stevens T.L.; Erickson B.R.; Morgan L.T.; Khristova M.L.; Hartman A.L.; Comer J.A.; Rollin P.E.; Ksiazek T.G.; Nichol S.T.,Bird,,multiple virus lineages sharing recent common ancestry were associated with a large rift valley fever outbreak among livestock in kenya during 2006-2007,Small relevant section: Evidence of interoutbreak RVF virus expansion and ongoing virus lineage evolution since the 1997-1998 epizootic/epidemic.; not sure generation time,article,virus,Rift Valley fever virus,host-pathogen,WGS,historical,10,NA,10.1128_JVI.01519-08.pdf,host-pathogen,host-pathogen
135,10.1128_JVI.02055-14.pdf,NA,NA,NA,NA,NA,NA,NA,NA,NA,NA,NA,NA,NA,NA,NA,NA,NA,NA,NA,NA,NA,NA,NA,,No,No,No,No,NA,NA,NA,NA,NA,NA,NA,NA,NA,NA,NA,boyle,yes,How has bluetongue virus evolved in Northern Australia?,"Largely purging selection, some regions experience positive selection",multiple_temporal,epidemic,"MEME, SLAC, FEL, IFEL, REL, and FUBAR",yes,NA,NA,boyle,no,NA,NA,NA,NA,NA,NA,suggests drift is a factor but doesn't explicitly quantify it,,,,,,,,,NA,NA,NA,NA,NA,NA,NA,NA,boyle,yes,single,natural_evolution,NA,path-o-gen used to investigate for clock-like-ness in molecular phylogenies,NA,NA,146,No,NA,NA,NA,NA,NA,NA,NA,august,10.1128/JVI.02055-14,2014,,NA,,,Boyle D.B.; Amos-Ritchie R.; Broz I.; Walker P.J.; Melville L.; Flanagan D.; Davis S.; Hunt N.; Weir R.,Boyle,,Evolution of bluetongue virus serotype 1 in northern Australia over 30 years,,article,virus,Bluetongue virus,host-pathogen,WGS,repeated,30 or 32,#N/A,10.1128_JVI.02055-14.pdf,host-pathogen,host-pathogen
136,10.1128_mBio.00987-21.pdf,NA,NA,NA,NA,NA,NA,NA,NA,NA,NA,NA,NA,NA,NA,NA,NA,NA,NA,NA,NA,NA,NA,NA,,No,No,No,No,NA,NA,NA,NA,NA,NA,NA,NA,NA,NA,NA,zlamal,yes,Is the evolution to drug resistance parallel in three Gram-negative bacteria species?,In some ways yes and in other ways no; shared genes,multiple_temporal,antibiotics,novel mutation identification; minimum inhibitory concentration analyses of mutations,yes,NA,NA,NA,NA,NA,NA,NA,NA,NA,NA,NA,,,,,,,,,NA,NA,NA,NA,NA,NA,NA,NA,NA,NA,NA,NA,NA,NA,NA,NA,147,Yes,zlamal,yes,partial,NA,partial,NA,mutations occurred in anywhere from 8 to 100% of replicates; Table1,august,10.1128/mBio.00987-21,2021,,NA,,,Zlamal; Jaime E.; Leyn; Semen A.; Iyer; Mallika; Elane; Marinela L.; Wong; Nicholas A.; Wamsley; James W.; Vercruysse; Maarten; Garcia-Alcalde; Fernando; Osterman; Andrei L.,Zlamal,,Shared and Unique Evolutionary Trajectories to Ciprofloxacin Resistance in Gram-Negative Bacterial Pathogens,,article,bacteria,Escherichia coli; Acinetobacter baumannii; Pseudomonas aeruginosa,experimental,WGS,experimental,0.010958904,288,10.1128_mBio.00987-21.pdf,host-pathogen,host-pathogen
137,10.1128_mSystems.00495-21.pdf,NA,NA,NA,NA,NA,NA,NA,NA,NA,NA,NA,NA,NA,NA,NA,NA,NA,NA,NA,NA,NA,NA,NA,DebRoy,Yes,No,No,No,no,NA,NA,NA,NA,NA,NA,NA,NA,NA,NA,debroy,yes,Has selection of clonal lineages shaped Streptococcus evolution in recent time?,yes,multiple temporal,host-pathogen,"phylogeny, structure",yes,NA,NA,NA,NA,NA,NA,NA,NA,NA,NA,NA,DebRoy,no,NA,NA,NA,NA,NA,NA,NA,NA,NA,NA,NA,NA,NA,NA,NA,NA,NA,NA,NA,NA,NA,NA,148,Yes,debroy,no,NA,NA,NA,NA,NA,may,10.1128/mSystems.00495-21,2021,mSystems,6,4,NA scopus NA,DebRoy S.; Sanson M.; Shah B.; Regmi S.; Vega L.A.; Odo C.; Sahasrabhojane P.; McGeer A.; Tyrrell G.J.; Fittipaldi N.; Shelburne S.A.; Flores A.R.,DebRoy,Evolution; Exotoxin; Genomics; Group A Streptococcus; M type; Population genetics; Virulence,population genomics of emm4 group a streptococcus reveals progressive replacement with a hypervirulent clone in north america,,article,bacteria,Streptococcus pyogenes,host-pathogen,WGS,historical,25,219000,10.1128_mSystems.00495-21.pdf,host-pathogen,host-pathogen
138,10.1128_msystems.01477-21.pdf,hwang,yes,NA,single,NA,"pneutral in nonconserved third codon positions as previously described by Kashtan et al. (9) In short, the formula Ne = 1.5pneutral/(m(324pneutral)) ",>2.3 x10^9,hwang,yes,multiple_spatial,natural evolution,nucleotide diversity,no change,NA,Lots of pi stats but no comparisons over time,NA,NA,NA,NA,NA,NA,NA,NA,Hwang,Yes,No,No,No,yes,temperature,increased,PCA and pairwise Fst,see doc,NA,NA,NA,NA,NA,NA,hwang,yes,How does selection act on a microbe in different environments? Does it act on whole genomes or genes?,Largely through effects on regulatory genes,multiple_spatial,natural evolution,pN/pS; Fst,yes,,,huwang,no,NA,NA,NA,NA,NA,NA,NA,Hwang,no,NA,NA,NA,NA,NA,NA,NA,NA,NA,NA,NA,NA,NA,NA,NA,NA,NA,NA,NA,NA,NA,NA,149,No,NA,NA,NA,NA,NA,NA,NA,august,10.1128/msystems.01477-21,2022,,NA,,,Hwang; Yunha; Girguis; Peter R.,Hwang,,Differentiated Evolutionary Strategies of Genetic Diversification in Atlantic and Pacific Thaumarchaeal Populations,,article,bacteria,Candidatus Nitrosopelagicus brevis,natural evolution,metagenomics,repeated,2 or 1,#N/A,10.1128_msystems.01477-21.pdf,natural evolution,natural evolution
139,10.1128_spectrum.01219-22.pdf,NA,NA,NA,NA,NA,NA,NA,NA,NA,NA,NA,NA,NA,NA,NA,NA,NA,NA,NA,NA,NA,NA,NA,,No,No,No,No,NA,NA,NA,NA,NA,NA,NA,NA,NA,NA,NA,periwal,no,NA,NA,NA,NA,NA,NA,NA,NA,NA,NA,NA,NA,NA,NA,NA,NA,NA,,,,,,,,,NA,NA,NA,NA,NA,NA,NA,NA,NA,NA,NA,NA,NA,NA,NA,NA,150,Yes,periwal,no,NA,NA,NA,NA,does discuss common mutations among sars viruses but does not explicitly test that goal ,august,10.1128/spectrum.01219-22,2022,,NA,,,Periwal N.; Rathod S.B.; Sarma S.; Johar G.S.; Jain A.; Barnwal R.P.; Srivastava K.R.; Kaur B.; Arora P.; Sood V.,Periwal,,Time Series Analysis of SARS-CoV-2 Genomes and Correlations among Highly Prevalent Mutations,,article,virus,Covid-19 virus,host-pathogen,WGS,historical,1.25 or 1.166666667,85.166691,10.1128_spectrum.01219-22.pdf,host-pathogen,host-pathogen
140,10.1128_spectrum.03128-23.pdf,NA,NA,NA,NA,NA,NA,NA,NA,NA,NA,NA,NA,NA,NA,NA,NA,NA,NA,NA,NA,NA,NA,NA,,No,No,No,No,NA,NA,NA,NA,NA,NA,NA,NA,NA,NA,NA,chaar,no,NA,NA,NA,NA,NA,NA,NA,NA,NA,NA,NA,NA,NA,NA,NA,NA,NA,,,,,,,,,NA,NA,NA,NA,NA,NA,NA,NA,Chaar,yes,single,antibiotic; anthropogeinc,none; found no signature of clockness,NA,NA,NA,151,No,NA,NA,NA,NA,NA,NA,NA,august,10.1128/spectrum.03128-23,2024,,NA,,,Chaar M.E.; Khoury Y.; Douglas G.M.; Kazzi S.E.; Jisr T.; Soussi S.; Merhi G.; Moghnieh R.A.; Shapiro B.J.,Chaar,,Longitudinal genomic surveillance of multidrug-resistant Escherichia coli carriage in critical care patients,,article,bacteria,Escherichia coli,host-pathogen,WGS,repeated,0.5 or 0.020547945,540,10.1128_spectrum.03128-23.pdf,host-pathogen,host-pathogen
141,10.1186_1471-2148-13-46.pdf,NA,NA,NA,NA,NA,NA,NA,NA,NA,NA,NA,NA,NA,NA,NA,NA,NA,NA,NA,NA,NA,NA,NA,,No,No,No,No,NA,NA,NA,NA,NA,NA,NA,NA,NA,NA,NA,bedhomme,yes,What impact does historical contingency have on evolution?,It impacts genotype but not phenotype,multiple_temporal,historical contingency,NA,NA,NA,NA,bedhomme,no,NA,NA,NA,NA,NA,NA,suggests drift is a factor but doesn't explicitly quantify it,,,,,,,,,NA,NA,NA,NA,NA,NA,NA,NA,NA,NA,NA,NA,NA,NA,NA,NA,152,Yes,bedhomme,yes,no,no,NA,NA,low level of parallel evolution; lots of divergence of sequences despite a shared environment,may,10.1186/1471-2148-13-46,2013,BMC Evolutionary Biology,13,1,NA scopus NA,Bedhomme S.; Lafforgue G.; Elena S.F.,Bedhomme,,genotypic but not phenotypic historical contingency revealed by viral experimental evolution,could not find generation time of this virus,article ,virus,Tobacco etch potyvirus,host-pathogen,WGS,experimental,0.287,NA,10.1186_1471-2148-13-46.pdf,host-pathogen,host-pathogen
142,10.1186_s12711-024-00900-y.pdf,somenzi,yes,domestication; anthropogenic,multiple_spatial,NA,SneP; currentNe,see notes file,NA,NA,NA,NA,NA,NA,NA,NA,somenzi,yes,multiple_temporal,"anthropgenic; replacement of local with ""more productive"" cattle",increase; almost all measures of inbreeding (Froh and mean ROH) increased from 2000-2018,Mean ROH & Froh,see notes doc,NA,Somenzi,Yes,No,No,No,yes,genetic management; anthropogenic factors,no change,PCA,see doc,yes,multiple_spatial; multiple_temporal,disease; population decline; anthropogenic,increase,Treemix,"(Fig in doc) Consistent with these historical documents, our admixture analysis at K = 8 (Fig.¬†2), revealed a genetic component shared among a number of breeds from the Alps and the Po valley. This result is further supported by the Treemix results (Fig.¬†4), which indicate three gene flow events affecting the northern Italian cattle.",somenzi,yes,How did selection act on a unique Italian cattle breed?,"milk and meat production, environmental adaptation, immune response",multiple_temporal,breeding; anthropogenic,"EHH, decay of haplotype homozygosity as genetic distance increases",yes,,,somenzi,no,NA,NA,NA,NA,NA,NA,NA,,,,,,,,,NA,NA,NA,NA,NA,NA,NA,NA,NA,NA,NA,NA,NA,NA,NA,NA,153,No,NA,NA,NA,NA,NA,NA,NA,may,10.1186/s12711-024-00900-y,2024,GENET SEL EVOL,56,1,NA scopus wos,Somenzi E.; Partel E.; Barbato M.; Chero Osorio A.M.; Colli L.; Franceschi N.; Mantovani R.; Pilla F.; Komjanc M.; Achilli A.; Hauffe H.C.; Ajmone Marsan P.,Somenzi,,genetic legacy and adaptive signatures: investigating the history; diversity; and selection signatures in rendena cattle resilient to eighteenth century rinderpest epidemics,,article,vertebrate,Bos primigenius,anthropogenic,reduced representation,historical,18,4.5,10.1186_s12711-024-00900-y.pdf,anthropogenic,anthropogenic
143,10.1186_s12862-016-0662-8.pdf,NA,NA,NA,NA,NA,NA,NA,NA,NA,NA,NA,NA,NA,NA,NA,plucain,NA,NA,NA,NA,NA,NA,NA,,No,No,No,No,NA,NA,NA,NA,NA,NA,NA,NA,NA,NA,NA,plucain,yes,What impact does historical contingency have on evolution?,It impacts it,multiple_temporal,historical contingency,NA,NA,NA,NA,NA,NA,NA,NA,NA,NA,NA,NA,NA,,,,,,,,,NA,NA,NA,NA,NA,NA,NA,NA,NA,NA,NA,NA,NA,NA,NA,NA,154,Yes,plucain,yes,no,no,partial,NA,mutations in 7 genes detected in >1 population; mutated genes were largely environment-specific in the first phase. Little parallelism/contingency in the second phase of evolution,may,10.1186/s12862-016-0662-8,2016,BMC EVOL BIOL,16,1,NA scopus wos,Plucain J.; Suau A.; Cruveiller S.; M‚àö¬©digue C.; Schneider D.; Le Gac M.,Plucain,Adaptation; Epistasis; Escherichia coli; Experimental evolution; Historical contingency,contrasting effects of historical contingency on phenotypic and genomic trajectories during a two-step evolution experiment with bacteria,,article,bacteria,Escherichia coli,experimental,WGS,experimental,0.341,1000,10.1186_s12862-016-0662-8.pdf,experimental,experimental
144,10.1186_s12862-021-01789-7.pdf,NA,NA,NA,NA,NA,NA,NA,NA,NA,NA,NA,NA,NA,NA,NA,NA,NA,NA,NA,NA,NA,NA,NA,,No,No,No,No,NA,NA,NA,NA,NA,NA,NA,NA,NA,NA,NA,o'hara,yes,Did a drought cause selection on genes related to fungal pathogen resistance in Brassica rapa?,yes,multiple_temporal,climate change; anthropogenic,"Fst, Tajima's D",yes,,,o'hara,no,NA,NA,NA,NA,NA,NA,NA,O'Hara,yes,multiple spatial,pathogens and drought,spacetime,both,yes,see doc,o'hara,yes,multiple_spatial,drought; climate change; anthropogenic,sliding window,see notes doc,yes,NA,NA,NA,NA,NA,NA,NA,NA,NA,155,No,NA,NA,NA,NA,NA,NA,NA,may,10.1186/s12862-021-01789-7,2021,BMC ECOL EVOL,21,1,NA scopus wos,O‚Äö√Ñ√¥Hara N.B.; Franks S.J.; Kane N.C.; Tittes S.; Rest J.S.,O‚Äö√Ñ√¥Hara,Alternaria brassicae; Brassica rapa; Climate change; Drought; Necrotrophic fungal pathogen response; Resurrection approach,evolution of pathogen response genes associated with increased disease susceptibility during adaptation to an extreme drought in a brassica rapa plant population,Resurrection experiment,article,plant,Brassica rapa,drought,WGS,historical,27,27,10.1186_s12862-021-01789-7.pdf,anthropogenic,anthropogenic
